"INDICATOR_CODE","INDICATOR_NAME","SOURCE_NOTE","SOURCE_ORGANIZATION",
"VC.IHR.PSRC.P5","Intentional homicides (per 100,000 people)","Intentional homicides are estimates of unlawful homicides purposely inflicted as a result of domestic disputes, interpersonal violence, violent conflicts over land resources, intergang violence over turf or control, and predatory violence and killing by armed groups. Intentional homicide does not include all intentional killing; the difference is usually in the organization of the killing. Individuals or small groups usually commit homicide, whereas killing in armed conflict is usually committed by fairly cohesive groups of up to several hundred members and is thus usually excluded.","UN Office on Drugs and Crime's International Homicide Statistics database.",
"VC.IHR.PSRC.MA.P5","Intentional homicides, male (per 100,000 male)","Intentional homicides, male are estimates of unlawful male homicides purposely inflicted as a result of domestic disputes, interpersonal violence, violent conflicts over land resources, intergang violence over turf or control, and predatory violence and killing by armed groups. Intentional homicide does not include all intentional killing; the difference is usually in the organization of the killing. Individuals or small groups usually commit homicide, whereas killing in armed conflict is usually committed by fairly cohesive groups of up to several hundred members and is thus usually excluded.","UN Office on Drugs and Crime's International Homicide Statistics database.",
"VC.IHR.PSRC.FE.P5","Intentional homicides, female (per 100,000 female)","Intentional homicides, female are estimates of unlawful female homicides purposely inflicted as a result of domestic disputes, interpersonal violence, violent conflicts over land resources, intergang violence over turf or control, and predatory violence and killing by armed groups. Intentional homicide does not include all intentional killing; the difference is usually in the organization of the killing. Individuals or small groups usually commit homicide, whereas killing in armed conflict is usually committed by fairly cohesive groups of up to several hundred members and is thus usually excluded.","UN Office on Drugs and Crime's International Homicide Statistics database.",
"VC.IDP.TOCV","Internally displaced persons, total displaced by conflict and violence (number of people)","Internally displaced persons are defined according to the 1998 Guiding Principles (http://www.internal-displacement.org/publications/1998/ocha-guiding-principles-on-internal-displacement) as people or groups of people who have been forced or obliged to flee or to leave their homes or places of habitual residence, in particular as a result of armed conflict, or to avoid the effects of armed conflict, situations of generalized violence, violations of human rights, or natural or human-made disasters and who have not crossed an international border. “People displaced” refers to the number of people living in displacement as of the end of each year, and reflects the stock of people displaced at the end of the previous year, plus inflows of new cases arriving over the year as well as births over the year to those displaced, minus outflows which may include returnees, those who settled elsewhere, those who integrated locally, those who travelled over borders, and deaths.","The Internal Displacement Monitoring Centre (http://www.internal-displacement.org/)",
"VC.IDP.NWDS","Internally displaced persons, new displacement associated with disasters (number of cases)","Internally displaced persons are defined according to the 1998 Guiding Principles (http://www.internal-displacement.org/publications/1998/ocha-guiding-principles-on-internal-displacement) as people or groups of people who have been forced or obliged to flee or to leave their homes or places of habitual residence, in particular as a result of armed conflict, or to avoid the effects of armed conflict, situations of generalized violence, violations of human rights, or natural or human-made disasters and who have not crossed an international border. ""New Displacement"" refers to the number of new cases or incidents of displacement recorded over the specified year, rather than the number of people displaced. This is done because people may have been displaced more than once.","The Internal Displacement Monitoring Centre (http://www.internal-displacement.org/)",
"VC.IDP.NWCV","Internally displaced persons, new displacement associated with conflict and violence (number of cases)","Internally displaced persons are defined according to the 1998 Guiding Principles (http://www.internal-displacement.org/publications/1998/ocha-guiding-principles-on-internal-displacement) as people or groups of people who have been forced or obliged to flee or to leave their homes or places of habitual residence, in particular as a result of armed conflict, or to avoid the effects of armed conflict, situations of generalized violence, violations of human rights, or natural or human-made disasters and who have not crossed an international border. ""New Displacement"" refers to the number of new cases or incidents of displacement recorded over the specified year, rather than the number of people displaced. This is done because people may have been displaced more than once.","The Internal Displacement Monitoring Centre (http://www.internal-displacement.org/)",
"VC.BTL.DETH","Battle-related deaths (number of people)","Battle-related deaths are deaths in battle-related conflicts between warring parties in the conflict dyad (two conflict units that are parties to a conflict). Typically, battle-related deaths occur in warfare involving the armed forces of the warring parties. This includes traditional battlefield fighting, guerrilla activities, and all kinds of bombardments of military units, cities, and villages, etc. The targets are usually the military itself and its installations or state institutions and state representatives, but there is often substantial collateral damage in the form of civilians being killed in crossfire, in indiscriminate bombings, etc. All deaths--military as well as civilian--incurred in such situations, are counted as battle-related deaths.","Uppsala Conflict Data Program, http://www.pcr.uu.se/research/ucdp/.",
"SG.GEN.PARL.ZS","Proportion of seats held by women in national parliaments (%)","Women in parliaments are the percentage of parliamentary seats in a single or lower chamber held by women.","Inter-Parliamentary Union (IPU) (www.ipu.org).  For the year of 1998, the data is as of August 10, 1998.",
"MS.MIL.XPRT.KD","Arms exports (SIPRI trend indicator values)","Arms transfers cover the supply of military weapons through sales, aid, gifts, and those made through manufacturing licenses. Data cover major conventional weapons such as aircraft, armored vehicles, artillery, radar systems, missiles, and ships designed for military use. Excluded are transfers of other military equipment such as small arms and light weapons, trucks, small artillery, ammunition, support equipment, technology transfers, and other services. Figures are SIPRI Trend Indicator Values (TIVs) expressed in US$ m.  A '0' indicates that the value of deliveries is less than US$0.5m","Stockholm International Peace Research Institute (SIPRI), Arms Transfers Programme (http://portal.sipri.org/publications/pages/transfer/splash).",
"MS.MIL.XPND.ZS","Military expenditure (% of general government expenditure)","Military expenditures data from SIPRI are derived from the NATO definition, which includes all current and capital expenditures on the armed forces, including peacekeeping forces; defense ministries and other government agencies engaged in defense projects; paramilitary forces, if these are judged to be trained and equipped for military operations; and military space activities. Such expenditures include military and civil personnel, including retirement pensions of military personnel and social services for personnel; operation and maintenance; procurement; military research and development; and military aid (in the military expenditures of the donor country). Excluded are civil defense and current expenditures for previous military activities, such as for veterans' benefits, demobilization, conversion, and destruction of weapons. This definition cannot be applied for all countries, however, since that would require much more detailed information than is available about what is included in military budgets and off-budget military expenditure items. (For example, military budgets might or might not cover civil defense, reserves and auxiliary forces, police and paramilitary forces, dual-purpose forces such as military and civilian police, military grants in kind, pensions for military personnel, and social security contributions paid by one part of government to another.)","Stockholm International Peace Research Institute (SIPRI), Yearbook: Armaments, Disarmament and International Security.",
"MS.MIL.XPND.GD.ZS","Military expenditure (% of GDP)","Military expenditures data from SIPRI are derived from the NATO definition, which includes all current and capital expenditures on the armed forces, including peacekeeping forces; defense ministries and other government agencies engaged in defense projects; paramilitary forces, if these are judged to be trained and equipped for military operations; and military space activities. Such expenditures include military and civil personnel, including retirement pensions of military personnel and social services for personnel; operation and maintenance; procurement; military research and development; and military aid (in the military expenditures of the donor country). Excluded are civil defense and current expenditures for previous military activities, such as for veterans' benefits, demobilization, conversion, and destruction of weapons. This definition cannot be applied for all countries, however, since that would require much more detailed information than is available about what is included in military budgets and off-budget military expenditure items. (For example, military budgets might or might not cover civil defense, reserves and auxiliary forces, police and paramilitary forces, dual-purpose forces such as military and civilian police, military grants in kind, pensions for military personnel, and social security contributions paid by one part of government to another.)","Stockholm International Peace Research Institute (SIPRI), Yearbook: Armaments, Disarmament and International Security.",
"MS.MIL.XPND.CN","Military expenditure (current LCU)","Military expenditures data from SIPRI are derived from the NATO definition, which includes all current and capital expenditures on the armed forces, including peacekeeping forces; defense ministries and other government agencies engaged in defense projects; paramilitary forces, if these are judged to be trained and equipped for military operations; and military space activities. Such expenditures include military and civil personnel, including retirement pensions of military personnel and social services for personnel; operation and maintenance; procurement; military research and development; and military aid (in the military expenditures of the donor country). Excluded are civil defense and current expenditures for previous military activities, such as for veterans' benefits, demobilization, conversion, and destruction of weapons. This definition cannot be applied for all countries, however, since that would require much more detailed information than is available about what is included in military budgets and off-budget military expenditure items. (For example, military budgets might or might not cover civil defense, reserves and auxiliary forces, police and paramilitary forces, dual-purpose forces such as military and civilian police, military grants in kind, pensions for military personnel, and social security contributions paid by one part of government to another.)","Stockholm International Peace Research Institute (SIPRI), Yearbook: Armaments, Disarmament and International Security.",
"MS.MIL.XPND.CD","Military expenditure (current USD)","Military expenditures data from SIPRI are derived from the NATO definition, which includes all current and capital expenditures on the armed forces, including peacekeeping forces; defense ministries and other government agencies engaged in defense projects; paramilitary forces, if these are judged to be trained and equipped for military operations; and military space activities. Such expenditures include military and civil personnel, including retirement pensions of military personnel and social services for personnel; operation and maintenance; procurement; military research and development; and military aid (in the military expenditures of the donor country). Excluded are civil defense and current expenditures for previous military activities, such as for veterans' benefits, demobilization, conversion, and destruction of weapons. This definition cannot be applied for all countries, however, since that would require much more detailed information than is available about what is included in military budgets and off-budget military expenditure items. (For example, military budgets might or might not cover civil defense, reserves and auxiliary forces, police and paramilitary forces, dual-purpose forces such as military and civilian police, military grants in kind, pensions for military personnel, and social security contributions paid by one part of government to another).","Stockholm International Peace Research Institute (SIPRI), Yearbook: Armaments, Disarmament and International Security.",
"MS.MIL.TOTL.TF.ZS","Armed forces personnel (% of total labor force)","Armed forces personnel are active duty military personnel, including paramilitary forces if the training, organization, equipment, and control suggest they may be used to support or replace regular military forces. Labor force comprises all people who meet the International Labour Organization's definition of the economically active population.","International Institute for Strategic Studies, The Military Balance.",
"MS.MIL.TOTL.P1","Armed forces personnel, total","Armed forces personnel are active duty military personnel, including paramilitary forces if the training, organization, equipment, and control suggest they may be used to support or replace regular military forces.","International Institute for Strategic Studies, The Military Balance.",
"MS.MIL.MPRT.KD","Arms imports (SIPRI trend indicator values)","Arms transfers cover the supply of military weapons through sales, aid, gifts, and those made through manufacturing licenses. Data cover major conventional weapons such as aircraft, armored vehicles, artillery, radar systems, missiles, and ships designed for military use. Excluded are transfers of other military equipment such as small arms and light weapons, trucks, small artillery, ammunition, support equipment, technology transfers, and other services. Figures are SIPRI Trend Indicator Values (TIVs) expressed in US$ m. A '0' indicates that the value of deliveries is less than US$0.5m.","Stockholm International Peace Research Institute (SIPRI), Arms Transfers Programme (http://portal.sipri.org/publications/pages/transfer/splash).",
"IQ.SPI.PIL5","Statistical performance indicators (SPI): Pillar 5 data infrastructure score (scale 0-100)","The data infrastructure  pillar  overall score measures the hard and soft infrastructure segments, itemizing essential cross cutting requirements for an effective statistical system.  The segments are: (i) legislation and governance covering the existence of laws and a functioning institutional framework for the statistical system; (ii) standards and methods addressing compliance with recognized frameworks and concepts; (iii) skills including level of skills within the statistical system and among users (statistical literacy); (iv) partnerships reflecting the need for the statistical system to be inclusive and coherent; and (v) finance mobilized both domestically and from donors.","Statistical Performance Indicators, The World Bank (https://datacatalog.worldbank.org/dataset/statistical-performance-indicators)",
"IQ.SPI.PIL4","Statistical performance indicators (SPI): Pillar 4 data sources score (scale 0-100)","The data sources overall score is a composity measure of whether countries have data available from the following sources: Censuses and surveys, administrative data, geospatial data, and private sector/citizen generated data.  The data sources (input) pillar is segmented by four types of sources generated by (i) the statistical office (censuses and surveys), and sources accessed from elsewhere such as (ii)  administrative data, (iii) geospatial data, and (iv) private sector data and citizen generated data. The appropriate balance between these source types will vary depending on a country’s institutional setting and the maturity of its statistical system. High scores should reflect the extent to which the sources being utilized enable the necessary statistical indicators to be generated. For example, a low score on environment statistics (in the data production pillar) may reflect a lack of use of (and low score for) geospatial data (in the data sources pillar). This type of linkage is inherent in the data cycle approach and can help highlight areas for investment required if country needs are to be met.","Statistical Performance Indicators, The World Bank (https://datacatalog.worldbank.org/dataset/statistical-performance-indicators)",
"IQ.SPI.PIL3","Statistical performance indicators (SPI): Pillar 3 data products score  (scale 0-100)","The data products overall score is a composite score measureing whether the country is able to produce relevant indicators, primarily related to SDGs.  The data products (internal process) pillar is segmented by four topics and organized into (i) social, (ii) economic, (iii) environmental, and (iv) institutional dimensions using the typology of the Sustainable Development Goals (SDGs). This approach anchors the national statistical system’s performance around the essential data required to support the achievement of the 2030 global goals, and enables comparisons across countries so that a global view can be generated while enabling country specific emphasis to reflect the user needs of that country.","Statistical Performance Indicators, The World Bank (https://datacatalog.worldbank.org/dataset/statistical-performance-indicators)",
"IQ.SPI.PIL2","Statistical performance indicators (SPI): Pillar 2 data services score (scale 0-100)","The data services pillar overall score is a composite indicator based on four dimensions of data services: (i) the quality of data releases, (ii) the richness and openness of online access, (iii) the effectiveness of advisory and analytical services related to statistics, and (iv) the availability and use of data access services such as secure microdata access. Advisory and analytical services might incorporate elements related to data stewardship services including input to national data strategies, advice on data ethics and calling out misuse of data in accordance with the Fundamental Principles of Official Statistics.","Statistical Performance Indicators, The World Bank (https://datacatalog.worldbank.org/dataset/statistical-performance-indicators)",
"IQ.SPI.PIL1","Statistical performance indicators (SPI): Pillar 1 data use score (scale 0-100)","The data use overall score is a composite score measuring the demand side of the statistical system.  The data use  pillar is segmented by five types of users: (i) the legislature, (ii) the executive branch, (iii) civil society (including sub-national actors), (iv) academia and (v) international bodies.  Each dimension would have associated indicators to measure performance. A mature system would score well across all dimensions whereas a less mature one would have weaker scores along certain dimensions. The gaps would give insights into prioritization among user groups and help answer questions as to why the existing services are not resulting in higher use of national statistics in a particular segment.  Currently, the SPI only features indicators for one of the five dimensions of data use, which is data use by international organizations. Indicators on whether statistical systems are providing useful data to their national governments (legislature and executive branches), to civil society, and to academia are absent.  Thus the dashboard does not yet assess if national statistical systems are meeting the data needs of a large swathe of users.","Statistical Performance Indicators, The World Bank (https://datacatalog.worldbank.org/dataset/statistical-performance-indicators)",
"IQ.SPI.OVRL","Statistical performance indicators (SPI): Overall score (scale 0-100)","The SPI overall score is a composite score measuing country performance across five pillars: data use, data services, data products, data sources, and data infrastructure.  The new Statistical Performance Indicators (SPI) will replace the Statistical Capacity Index (SCI), which the World Bank has regularly published since 2004. Although the goals are the same, to offer a better tool to measure the statistical systems of countries, the new SPI framework has expanded into new areas including in the areas of data use, administrative data, geospatial data, data services, and data infrastructure. The SPI provides a framework that can help countries measure where they stand in several dimensions and offers an ambitious measurement agenda for the international community.","Statistical Performance Indicators, The World Bank (https://datacatalog.worldbank.org/dataset/statistical-performance-indicators)",
"IQ.SCI.SRCE","Source data assessment of statistical capacity (scale 0 - 100)","The source data indicator reflects whether a country conducts data collection activities in line with internationally recommended periodicity, and whether data from administrative systems are available. The source data score is calculated as the weighted average of 5 underlying indicator scores. The final source data score contributes 1/3 of the overall Statistical Capacity Indicator score.","World Bank, Bulletin Board on Statistical Capacity (http://bbsc.worldbank.org).",
"IQ.SCI.PRDC","Periodicity and timeliness assessment of statistical capacity (scale 0 - 100)","The periodicity and timeliness indicator assesses the availability and periodicity of key socioeconomic indicators. It measures the extent to which data are made accessible to users through transformation of source data into timely statistical outputs. The periodicity score is calculated as the weighted average of 10 underlying indicator scores. The final periodicity score contributes 1/3 of the overall Statistical Capacity Indicator score.","World Bank, Bulletin Board on Statistical Capacity (http://bbsc.worldbank.org).",
"IQ.SCI.OVRL","Statistical Capacity score (Overall average)","The Statistical Capacity Indicator is a composite score assessing the capacity of a country’s statistical system. It is based on a diagnostic framework assessing the following areas: methodology; data sources; and periodicity and timeliness. Countries are scored against 25 criteria in these areas, using publicly available information and/or country input. The overall Statistical Capacity score is then calculated as a simple average of all three area scores on a scale of 0-100.","World Bank, Bulletin Board on Statistical Capacity (http://bbsc.worldbank.org).",
"IQ.SCI.MTHD","Methodology assessment of statistical capacity (scale 0 - 100)","The methodology indicator measures a country’s ability to adhere to internationally recommended standards and methods. The methodology score is calculated as the weighted average of 10 underlying indicator scores. The final methodology score contributes 1/3 of the overall Statistical Capacity Indicator score.","World Bank, Bulletin Board on Statistical Capacity (http://bbsc.worldbank.org).",
"IQ.CPA.TRAN.XQ","CPIA transparency, accountability, and corruption in the public sector rating (1=low to 6=high)","Transparency, accountability, and corruption in the public sector assess the extent to which the executive can be held accountable for its use of funds and for the results of its actions by the electorate and by the legislature and judiciary, and the extent to which public employees within the executive are required to account for administrative decisions, use of resources, and results obtained. The three main dimensions assessed here are the accountability of the executive to oversight institutions and of public employees for their performance, access of civil society to information on public affairs, and state capture by narrow vested interests.","World Bank Group, CPIA database (http://www.worldbank.org/ida).",
"IQ.CPA.TRAD.XQ","CPIA trade rating (1=low to 6=high)","Trade assesses how the policy framework fosters trade in goods.","World Bank Group, CPIA database (http://www.worldbank.org/ida).",
"IQ.CPA.STRC.XQ","CPIA structural policies cluster average (1=low to 6=high)","The structural policies cluster includes trade, financial sector, and business regulatory environment.","World Bank Group, CPIA database (http://www.worldbank.org/ida).",
"IQ.CPA.SOCI.XQ","CPIA policies for social inclusion/equity cluster average (1=low to 6=high)","The policies for social inclusion and equity cluster includes gender equality, equity of public resource use, building human resources, social protection and labor, and policies and institutions for environmental sustainability.","World Bank Group, CPIA database (http://www.worldbank.org/ida).",
